row_id,message,cluster_id,message_clean,represent_name
1127,chochanhee5573@cluster.com/(+81)080-6042-5573padpadpro(12.9___)Wi-Fi+cellular(512GB)+81-80-6042-5573CHOCHANHEE),4,"[chochanhee5573, cluster, com, 81, 080, 6042, 5573padpadpro, 12, 9, wi, fi, cellular, 512gb, 81, 80, 6042, 5573chochanhee]","smartphone,four"
2775,I wanted to find WiFi providers,4,"[want, find, wifi, providers]","smartphone,four"
2880,"Need a clock on the texting page. ShouldnÕt have to use what you are texting to check the time.""",4,"[need, clock, texting, page, use, texting, check, time]","smartphone,four"
1170,SmartPhone x exactly what product to the hot serious serious dropped frames cannot achieve the mWindowst rapid experienceÉ would have an idea of the user experience device do not appear with the question of product performance to high to reach entertainment results in the waste of i buy top products for the purpWindowse of performance if the issue cannot be resolved in the next I have confidence in the products.,4,"[smartphone, x, exactly, product, hot, serious, serious, drop, frame, achieve, mwindowst, rapid, experience, would, idea, user, experience, device, appear, question, product, performance, high, reach, entertainment, result, waste, buy, top, products, purpwindowse, performance, issue, resolve, next, confidence, products]","smartphone,four"
2763,It is recommended that photWindows in the photo book site people screenshot folder you can choWindowse to display,4,"[recommend, photwindows, photo, book, site, people, screenshot, folder, chowindowse, display]","smartphone,four"
2761,I am on 7 February that the product can return?,4,"[7, february, product, return]","smartphone,four"
2760,I am 3 month õphone 8 plus continuous recording and placed at the rear on the 5 month window was broken and there is something of interest to your 2 thousand tl dersem Device sends a new one he said is already paid 7 thousand defects up to this cause i cannot believe a sliding phon,4,"[3, month, phone, 8, plus, continuous, record, place, rear, 5, month, window, break, something, interest, 2, thousand, tl, dersem, device, send, new, one, say, already, pay, 7, thousand, defect, cause, believe, slide, phon]","smartphone,four"
4003,Please Automatically Setup My Device ID SmartPhone,4,"[please, automatically, setup, device, id, smartphone]","smartphone,four"
2778,This happens every month,4,"[happen, every, month]","smartphone,four"
2878,"Device X pWindowsition off, find the bug out of the system pWindowsitioning mark also appears for a few seconds.",4,"[device, x, pwindowsition, find, bug, system, pwindowsitioning, mark, also, appear, second]","smartphone,four"
337,"""In the middle of the Chinese people texting less and less now about 90 per cent of the message is spam Device has to focus on this work out so many tricks have actual meaning it",4,"[middle, chinese, people, texting, less, less, 90, per, cent, message, spam, device, focus, work, many, trick, actual, mean]","smartphone,four"
1123,"""Dear Device management",4,"[dear, device, management]","smartphone,four"
4083,Don't be a key to answer the call of the QQ,4,"[key, answer, call, qq]","smartphone,four"
3663,Service de plus en plus dplorable,4,"[service, de, plus, en, plus, plorable]","smartphone,four"
2923,Hello Sir I'm having trouble creating a new account apelleide and adding a Visa card to buy from the new motherboard Do you help me !!,4,"[hello, sir, trouble, create, new, account, apelleide, add, visa, card, buy, new, motherboard, help]","smartphone,four"
2914,"My ld compromised caused considerable economic and spiritual lWindowss failure so far to resolve is also unable to provide suspects prisoners i do you do not longer longer is another one of _ _, return to modify the behavior of a Thank You",4,"[ld, compromise, cause, considerable, economic, spiritual, lwindowss, failure, far, resolve, also, unable, provide, suspect, prisoners, longer, longer, another, one, return, modify, behavior, thank]","smartphone,four"
2904,SmartPhone storage space each time you open are in the ring and then exit will not be stuck,4,"[smartphone, storage, space, time, open, ring, exit, stick]","smartphone,four"
1143,"With kind regards,",4,"[kind, regard]","smartphone,four"
1142,"""Moin Moin! Since updating to 11.3 """"sticks"""" to the touch screen time. No connection with app's or actions. I hope this little problem as soon as pWindowssible is dissolved.",4,"[moin, moin, since, update, 11, 3, stick, touch, screen, time, connection, app, action, hope, little, problem, soon, pwindowssible, dissolve]","smartphone,four"
2909,and then there is the Auto Power On do not know the cause,4,"[auto, power, know, cause]","smartphone,four"
2910,"feedback, I hope to reply to reply to...""",4,"[feedback, hope, reply, reply]","smartphone,four"
346,Why does the United States have no English,4,"[unite, state, english]","smartphone,four"
4019,"""Phone reservation, and it is the slower of the Coming 10 minutes or more, there has not been well from the pain of waiting times.",4,"[phone, reservation, slower, come, 10, minutes, well, pain, wait, time]","smartphone,four"
356,"three hours, not including the time back and forth",4,"[three, hours, include, time, back, forth]","smartphone,four"
2917,had a very bad experience very easy to roll back to the top I don't want to have time to the top. So I would like to look at today's photo you would like to return to return to return to the Year view this year found a little onto today. Too ambitious.,4,"[bad, experience, easy, roll, back, top, want, time, top, would, like, look, today, photo, would, like, return, return, return, year, view, year, find, little, onto, today, ambitious]","smartphone,four"
4017,Please Help Automatically Setup My Iphone,4,"[please, help, automatically, setup, iphone]","smartphone,four"
341,The team then why not willing to understand the market must be the history of reverse it,4,"[team, will, understand, market, must, history, reverse]","smartphone,four"
2919,"If you do not so easily onto the top.""",4,"[easily, onto, top]","smartphone,four"
353,"""Very disappointed with the device battery junk phone card fatal",4,"[disappoint, device, battery, junk, phone, card, fatal]","smartphone,four"
1280,My SmartPhone trincou the rear window only to drop on a tour of granite. I always SmartPhone all very resistant and with the quality of the products always Device then invested almWindowst 5 thousand reais on SmartPhone 8 Plus and i feel cheated. The bracket,4,"[smartphone, trincou, rear, window, drop, tour, granite, always, smartphone, resistant, quality, products, always, device, invest, almwindowst, 5, thousand, reais, smartphone, 8, plus, feel, cheat, bracket]","smartphone,four"
4002,"What a disappointment and bad service, it turns out that there is to leave in the first place the phone for a diagnWindowsis and after diagnWindowsis, expected to reach the battery if applicable. In""",4,"[disappointment, bad, service, turn, leave, first, place, phone, diagnwindowsis, diagnwindowsis, expect, reach, battery, applicable]","smartphone,four"
2756,I just wanted to know how to know how many years in my SmartPhone ???,4,"[want, know, know, many, years, smartphone]","smartphone,four"
1087,Reduced charge life,4,"[reduce, charge, life]","smartphone,four"
1118,I had a problem with the audriculares that weren't functioning pass by the shop of Majadahonda Plaza North i tell me that I didn't change that grabs a year change the rules do not think to buy back a SmartPhone i always share several: the chich,4,"[problem, audriculares, function, pass, shop, majadahonda, plaza, north, tell, change, grab, year, change, rule, think, buy, back, smartphone, always, share, several, chich]","smartphone,four"
2735,"One could almWindowst have the impress""",4,"[one, could, almwindowst, impress]","smartphone,four"
2959,I need all so I can re vip,4,"[need, vip]","smartphone,four"
2789,Exit every time you need to log in looking to improve,4,"[exit, every, time, need, log, look, improve]","smartphone,four"
4043,I donÕt buy nothing I want my money back,4,"[buy, nothing, want, money, back]","smartphone,four"
2960,I need every thing correct,4,"[need, every, thing, correct]","smartphone,four"
2961,Hello Web Browser does li MORE VIDEO OF SITES How can I solve the problem I has a SmartPhone 7 Thank You,4,"[hello, web, browser, li, video, sit, solve, problem, smartphone, 7, thank]","smartphone,four"
2967,Not to outside with privacy and talk. And information lies rumors and case info might be a need,4,"[outside, privacy, talk, information, lie, rumor, case, info, might, need]","smartphone,four"
1099,I was looking at some things yesterday but I did not Tink I signed up for something ,4,"[look, things, yesterday, tink, sign, something]","smartphone,four"
2975,"thank you to help me in the more quickly I of Important hint""",4,"[thank, help, quickly, important, hint]","smartphone,four"
1093,"""What is I cloud storage for 2.99 ?",4,"[cloud, storage, 2, 99]","smartphone,four"
1092,Thank you very much.,4,"[thank, much]","smartphone,four"
1259,"The game downloads to tap into it. Click on the need to try out for three days. Try out three days after three days next to the charge of $58. You want to play this game I downloaded the I click the play. However, the download is found to be the first day of fun. I would have been. But I did not know I deleted the app I have been deducted $58. This is why they were detained. I have been deleted. Finally, I would like to re-download from app, tap the painting software opens with a very small word Cancel will cancel the subscription. It is really sad. I hope device official to give a response. I've seen this software app. In the same situation as I have several individuals. There were three days of continuous net 58. I hope device official to help resolve Thank You""",4,"[game, download, tap, click, need, try, three, days, try, three, days, three, days, next, charge, 58, want, play, game, download, click, play, however, download, find, first, day, fun, would, know, delete, app, deduct, 58, detain, delete, finally, would, like, download, app, tap, paint, software, open, small, word, cancel, cancel, subscription, really, sad, hope, device, official, give, response, see, software, app, situation, several, individuals, three, days, continuous, net, 58, hope, device, official, help, resolve, thank]","smartphone,four"
1190,I want to make an appointment with the Genius Bar - I have checked on line and they suggest downloading the Device app which I have done. But the Device app does not seem to recognise Êthat occasionally it would be so much easier to speak to someone in pers,4,"[want, make, appointment, genius, bar, check, line, suggest, download, device, app, do, device, app, seem, recognise, occasionally, would, much, easier, speak, someone, pers]","smartphone,four"
2984,Legal notifications and flags,4,"[legal, notifications, flag]","smartphone,four"
2987,I keep primary and full the copy vip for own version,4,"[keep, primary, full, copy, vip, version]","smartphone,four"
1184,"""Hello. I have just discovered that an App, Orbyt, i have been charged unduly and in duplicate several times.",4,"[hello, discover, app, orbyt, charge, unduly, duplicate, several, time]","smartphone,four"
2783,SmartPhone x games half an hour or so to start hot. The picture start card himself. Previous 6 had never had to be resolved.,4,"[smartphone, x, game, half, hour, start, hot, picture, start, card, previous, 6, never, resolve]","smartphone,four"
381,When the app purchase deduction deduction has been 3 times cant download does not display the Purchase Records,4,"[app, purchase, deduction, deduction, 3, time, cant, download, display, purchase, record]","smartphone,four"
2748,"""I'm being charged for an app, Insta Size, that I didn't order. You phone number is not in service. When we try to review the order it goes to a random page. The confirmation # given is 884152566.",4,"[charge, app, insta, size, order, phone, number, service, try, review, order, go, random, page, confirmation, give, 884152566]","smartphone,four"
2755,I need to know how to pass the info of my SmartPhone SmartPhone 7 to my new X,4,"[need, know, pass, info, smartphone, smartphone, 7, new, x]","smartphone,four"
1171,"""I need a duplicate purchase of this cell, was purchased in Miami in January 2017.",4,"[need, duplicate, purchase, cell, purchase, miami, january, 2017]","smartphone,four"
2947,"This is ridiculous. ÊÊIt should not take 1 day, let alone potentially up to 5 business days to correct a payment that did not complete to funds being depWindowsited/available in the designated account. ÊFind out how to get the 200$ back in my Device Pay account",4,"[ridiculous, take, 1, day, let, alone, potentially, 5, business, days, correct, payment, complete, fund, depwindowsited, available, designate, account, find, get, 200, back, device, pay, account]","smartphone,four"
2875,"4/8/2018: ÊWhen will you install (TV series )CONTINUOUS PLAY in your TV APP? ÊYou used to have it until you UPDATED to this new app. ÊThere are just SOME THINGS that should NOT be new, improved and/or updated.",4,"[4, 8, 2018, install, tv, series, continuous, play, tv, app, use, update, new, app, things, new, improve, update]","smartphone,four"
1117,New to devices want to say thank you for the new iWindows works awesome,4,"[new, devices, want, say, thank, new, iwindows, work, awesome]","smartphone,four"
1172,The cel was blocked by the carrier by mistake is accurate fiscal note to unlock.,4,"[cel, block, carrier, mistake, accurate, fiscal, note, unlock]","smartphone,four"
4088,I called Comcast 3_3 times the people disconnected me the first gentleman ended up taking my charge card to verify my account you took four different charge cards and then to find out it was three first one I also went on this application and they said th,4,"[call, comcast, 3, 3, time, people, disconnect, first, gentleman, end, take, charge, card, verify, account, take, four, different, charge, card, find, three, first, one, also, go, application, say, th]","smartphone,four"
4039,In the future of your company. We are looking forward to playing.,4,"[future, company, look, forward, play]","smartphone,four"
1175,Please send my request or recommendation to Device to keep the ability to disable apps with lock code that customers do not wish to use. ÊÊSecurity issue like find my SmartPhone tracking. ÊÊHackers & thieves love that capacity! ÊI hate it! ItÕs privacy issue &,4,"[please, send, request, recommendation, device, keep, ability, disable, apps, lock, code, customers, wish, use, security, issue, like, find, smartphone, track, hackers, thieve, love, capacity, hate, privacy, issue]","smartphone,four"
3997,"It seems to me that force the off with key, helps to reduce theft",4,"[seem, force, key, help, reduce, theft]","smartphone,four"
2744,I was just charge a application that I never confirm the purchase .,4,"[charge, application, never, confirm, purchase]","smartphone,four"
4077,"Device Watch workout application, when you choWindowse ""Other"", just sitting in the chair that just still to move ring, an exercise ring, both to increase the number more and more. Also, regardless of the number of heart rate as well as GPS sensors by simply selecting any other activity is increased, it would be, I think, without compromising the reliability of Device Watch settings. The ""other"" about items you hope to improve the functionality.",4,"[device, watch, workout, application, chowindowse, sit, chair, still, move, ring, exercise, ring, increase, number, also, regardless, number, heart, rate, well, gps, sensors, simply, select, activity, increase, would, think, without, compromise, reliability, device, watch, settings, items, hope, improve, functionality]","smartphone,four"
2870,There is a problem with the APPID Link server.,4,"[problem, appid, link, server]","smartphone,four"
1180,"""Hello support team, IÕd really appreciate it if my phone number would get activated for FaceTime and Messages!",4,"[hello, support, team, really, appreciate, phone, number, would, get, activate, facetime, message]","smartphone,four"
3043,"I have a complaint i do not know what section i must be, I tell you this now since the update does my phone very weird i have a 8 SmartPhone plus if i have a film or game after the clWindowse of the app stay hanging on fullscreen mode runs every time h",4,"[complaint, know, section, must, tell, since, update, phone, weird, 8, smartphone, plus, film, game, clwindowse, app, stay, hang, fullscreen, mode, run, every, time, h]","smartphone,four"
3188,"Pencil defect, call and ask the first, without a clear support to go to the store to be replaced Kitamura, so here is a book in the Shinsaibashi can't shop after 13:50 And the thing, and I'm going to reflect the reservations were chopped finely, even though plenty of people will be waiting for you at any time within 20 minutes wait I still don't know known as the thing to do, so I do not know the reservation. And I'm waiting for a lot of people who don't anxiety remains during the end of the top of the repair support is not a replacement. About 8,000 yen including tax is a new tax 11,0""",4,"[pencil, defect, call, ask, first, without, clear, support, go, store, replace, kitamura, book, shinsaibashi, shop, 13, 50, thing, go, reflect, reservations, chop, finely, even, though, plenty, people, wait, time, within, 20, minutes, wait, still, know, know, thing, know, reservation, wait, lot, people, anxiety, remain, end, top, repair, support, replacement, 8, 000, yen, include, tax, new, tax, 11, 0]","smartphone,four"
1054,"""At 12:30 pm i had of you should be called as it was agreed on the basis of your App!",4,"[12, 30, pm, call, agree, basis, app]","smartphone,four"
3468,Good i have today I had a bad experience with my SmartPhone X why I was frozen and i also marks the performance of my battery is 98% and that should not happen to a new device,4,"[good, today, bad, experience, smartphone, x, freeze, also, mark, performance, battery, 98, happen, new, device]","smartphone,four"
787,"you can search or to reject the application and wasting time.""",4,"[search, reject, application, waste, time]","smartphone,four"
554,"I donÕt know which update it was, but now when I get a response from a text, the response text goes above mine, so sometimes I donÕt know the person ever responded. ÊItÕs annoying. ÊIt should go I order.",4,"[know, update, get, response, text, response, text, go, mine, sometimes, know, person, ever, respond, annoy, go, order]","smartphone,four"
3442,I think it would nice to be able to add a case Id. I have one going for an Device TV repair that is not listed in the support app.,4,"[think, would, nice, able, add, case, id, one, go, device, tv, repair, list, support, app]","smartphone,four"
771,I'm having problems on the camera back of SmartPhone reportedly my appliance is among thWindowse who had problems. How do I replace??,4,"[problems, camera, back, smartphone, reportedly, appliance, among, thwindowse, problems, replace]","smartphone,four"
3446,Just use two app body feels hot to the touch. The heat.,4,"[use, two, app, body, feel, hot, touch, heat]","smartphone,four"
3784,"Until now, the device products for many years, including devices and watch available, but this time I felt that it was a bad device's response garnered",4,"[device, products, many, years, include, devices, watch, available, time, felt, bad, device, response, garner]","smartphone,four"
3783,"waste, I do not understand that only the legs will come back to give up.",4,"[waste, understand, legs, come, back, give]","smartphone,four"
765,"I've just updated both SmartPhone 7 and pad air2, and there are same problem said above in both devices. I want to""",4,"[update, smartphone, 7, pad, air2, problem, say, devices, want]","smartphone,four"
761,"Device Store, keynote lectures have been unable to update, reboot the switch network will not be able to update is to _ status. PowerPoint4.0 March 27 version.",4,"[device, store, keynote, lecture, unable, update, reboot, switch, network, able, update, status, powerpoint4, 0, march, 27, version]","smartphone,four"
760,"Kind Regards""",4,"[kind, regard]","smartphone,four"
3771,In? ItÕs always none! ,4,"[always, none]","smartphone,four"
3465,one of my I phone 7 Ê( gold 128gb) has issues with service WiFi connectivity device getting frozen just after 5 months of use. I submitted this last Friday with commitments of one week.Tried calling Device customer care store after long wait representative,4,"[one, phone, 7, gold, 128gb, issue, service, wifi, connectivity, device, get, freeze, 5, months, use, submit, last, friday, commitments, one, week, try, call, device, customer, care, store, long, wait, representative]","smartphone,four"
754,I went to Android Games. All confusing. ,4,"[go, android, game, confuse]","smartphone,four"
791,"""Need help improving my app & phone battery.",4,"[need, help, improve, app, phone, battery]","smartphone,four"
3768,Is always none? Cause of my idenity theft!,4,"[always, none, cause, idenity, theft]","smartphone,four"
3475,Hello I would like to have mode of payment,4,"[hello, would, like, mode, payment]","smartphone,four"
3476,Obviously there is a problem then detection for a variety of reasons _ responsibility is to report to the 12315 line only.,4,"[obviously, problem, detection, variety, reason, responsibility, report, 12315, line]","smartphone,four"
3478,"""For the last two days trying to schedule a service call and there is no way to work",4,"[last, two, days, try, schedule, service, call, way, work]","smartphone,four"
749,Since the SmartPhone himself as the Device 8 plus user has already been used for more than a year! But your company's products such as large apps is the SmartPhone X-based. Look Like ignore the 8/8plus user synchronization SmartPhone X and 8/8plus. I hope your Company 8/8plus envisaged for the user. @ With the i8plus of the user.,4,"[since, smartphone, device, 8, plus, user, already, use, year, company, products, large, apps, smartphone, x, base, look, like, ignore, 8, 8plus, user, synchronization, smartphone, x, 8, 8plus, hope, company, 8, 8plus, envisage, user, i8plus, user]","smartphone,four"
3493,The next time you no longer use device products,4,"[next, time, longer, use, device, products]","smartphone,four"
3756,My phone was bought used by my boyfriend and IÕm on his att plan but IÕm having all kinds of problems,4,"[phone, buy, use, boyfriend, att, plan, kinds, problems]","smartphone,four"
3509,I can't make it cause this screenshot of the Iphone x makes no new,4,"[make, cause, screenshot, iphone, x, make, new]","smartphone,four"
574,Needs the ability to delete purchases from hidden purchases,4,"[need, ability, delete, purchase, hide, purchase]","smartphone,four"
3516,I am very disappointed with your services after the last upliit the phone goes awful on April 3rd I was charged and I do not know why if I do not get explanations about what it is I'll give up your products I'll go to android,4,"[disappoint, service, last, upliit, phone, go, awful, april, 3rd, charge, know, get, explanations, give, products, go, android]","smartphone,four"
3517,The recent purchase of gaming products as a result of the Non-operating result in changes in the amount I also want to thank the official recovery,4,"[recent, purchase, game, products, result, non, operate, result, change, amount, also, want, thank, official, recovery]","smartphone,four"
3518,Non-I purchased a product name is the daughter of the western tour,4,"[non, purchase, product, name, daughter, western, tour]","smartphone,four"
3432,Up to a little before the phone will automatically restart after kitlenmedi ba_lattõm has been triggered. SmartPhone 8 plus,4,"[little, phone, automatically, restart, kitlenmedi, ba, latt, trigger, smartphone, 8, plus]","smartphone,four"
3791,"""Well as I still donÕt have this phone hooked up properly I never followed the directions plan to do so soon as pWindowssible. I transfer from my SmartPhone 6And now I have a SmartPhone 8plus and tablet.",4,"[well, still, phone, hook, properly, never, follow, directions, plan, soon, pwindowssible, transfer, smartphone, 6and, smartphone, 8plus, tablet]","smartphone,four"
3046,"Synchronize much better Device Watch ""playing"" with SmartPhone",4,"[synchronize, much, better, device, watch, play, smartphone]","smartphone,four"
825,"ORDER DATE: April 02, 2018",4,"[order, date, april, 02, 2018]","smartphone,four"
