row_id,message,cluster_id,message_clean,represent_name
3512,"After login is always a contact telephone of i see no longer exists. I cannot change in the Support app, not even in the Settings or Deviceid.device.com",3,"[login, always, contact, telephone, see, longer, exist, change, support, app, even, settings, deviceid, device, com]","email,account"
752,CanÕt purchase items In app please call at972-632-6493,3,"[purchase, items, app, please, call, at972, 632, 6493]","email,account"
2037,I donÕt know what my 4 digit security number is when making changes in security changes.,3,"[know, 4, digit, security, number, make, change, security, change]","email,account"
4486,I received a email that you called. ÊIÕve been waiting. ÊI have no record of a missed call on my SmartPhone.,3,"[receive, email, call, wait, record, miss, call, smartphone]","email,account"
1781,I mailbox password forgot to do the,3,"[mailbox, password, forget]","email,account"
2041,Tomorrow give me a call is a call to the complaints of the unprovoked has more than 508 more contacts you may rest assured my id so far on my own mobile phone use,3,"[tomorrow, give, call, call, complaints, unprovoked, 508, contact, may, rest, assure, id, far, mobile, phone, use]","email,account"
3466,"Line was cut into,there was a different IP address and I am with t-mobile. Please check connections over past 3 days.thank you concerned.612-232-0942 jseacollins@cluster.com",3,"[line, cut, different, ip, address, mobile, please, check, connections, past, 3, days, thank, concern, 612, 232, 0942, jseacollins, cluster, com]","email,account"
3769,No way will I put credit cards on none of ,3,"[way, put, credit, card, none]","email,account"
4483,I cannot change an out of date phone number,3,"[change, date, phone, number]","email,account"
2045,Contact Us does not appear in the chat.,3,"[contact, us, appear, chat]","email,account"
1762,joob1991@gmail.com to access in the SmartPhone,3,"[joob1991, gmail, com, access, smartphone]","email,account"
2057,Messages in Cluster are disabled..,3,"[message, cluster, disable]","email,account"
3448,Hello someone has been using my Device ID to hack into my phone link my phone with there watch mess with my settings and pry into my personal business readying my messages listen to my phone calls and logging in my phone and onto my account without my conv,3,"[hello, someone, use, device, id, hack, phone, link, phone, watch, mess, settings, pry, personal, business, ready, message, listen, phone, call, log, phone, onto, account, without, conv]","email,account"
1761,"""The devices tell an Device id",3,"[devices, tell, device, id]","email,account"
4468,"""Sorry my email is evelynWindowshogwe@gmail.com ",3,"[sorry, email, evelynwindowshogwe, gmail, com]","email,account"
3444,What is meant by email address?,3,"[mean, email, address]","email,account"
1756,It is likely that the number 4079954475 is already disabled by being out of the country. It is pWindowssible to retrieve user Mervinhera@cluster.com if i changed my number and code?,3,"[likely, number, 4079954475, already, disable, country, pwindowssible, retrieve, user, mervinhera, cluster, com, change, number, code]","email,account"
775,IÕm going back,3,"[go, back]","email,account"
4469,"evolala@cluster.com""",3,"[evolala, cluster, com]","email,account"
1281,Hi I need to get into my Device ID but it wonÕt let me change my security questions,3,"[hi, need, get, device, id, let, change, security, question]","email,account"
913,Do not have extra Cluster address!,3,"[extra, cluster, address]","email,account"
2522,Fraud transaction ID0218501,3,"[fraud, transaction, id0218501]","email,account"
4216,"Property...I have been change my telephone number and the application doesnÕt recognise this devise and I suppWindowse to open another one..In this case I have lWindowst all my information from""",3,"[property, change, telephone, number, application, recognise, devise, suppwindowse, open, another, one, case, lwindowst, information]","email,account"
2877,I donÕt know if IÕm backed up or not In MusicPlayer or Cluster?,3,"[know, back, musicplayer, cluster]","email,account"
2514,"""Received an email suppWindowsedly from Device. I did NOT order this at all. ",3,"[receive, email, suppwindowsedly, device, order]","email,account"
2513,Why does my app they are said to be disabled?,3,"[app, say, disable]","email,account"
1450,"I deactivate the Device ID, how do you get?",3,"[deactivate, device, id, get]","email,account"
4037,phishing e-mail message.,3,"[phishing, e, mail, message]","email,account"
2509,Please cancel MusicPlayer for Screen. Tried as instructed did not work. Please make sure I do not get billed again. I never use it. Want refund from April 6 charge. Please confirm cancellation and refund. Thank you Katherine Menagh,3,"[please, cancel, musicplayer, screen, try, instruct, work, please, make, sure, get, bill, never, use, want, refund, april, 6, charge, please, confirm, cancellation, refund, thank, katherine, menagh]","email,account"
232,"""Help support",3,"[help, support]","email,account"
4031,"""Here is what you should send your personnel, and I didn't have.",3,"[send, personnel]","email,account"
1453,May was purchased with the trade-in and has requested to,3,"[may, purchase, trade, request]","email,account"
4029,dear harunoyume@cluster.com source address,3,"[dear, harunoyume, cluster, com, source, address]","email,account"
1152,Hello I have a mobile phone Device ID,3,"[hello, mobile, phone, device, id]","email,account"
4028,noreply-dez@deviceid.blactdrusscrug.fob.com,3,"[noreply, dez, deviceid, blactdrusscrug, fob, com]","email,account"
2895,To send an email to yourself and the name of the father come back.,3,"[send, email, name, father, come, back]","email,account"
1147,"You can update the account, however, not be able to purchase a new app",3,"[update, account, however, able, purchase, new, app]","email,account"
2521,"""Requested to know about an email received whWindowse subject is the following :",3,"[request, know, email, receive, whwindowse, subject, follow]","email,account"
1178,"""Hello? We have an application that he must cancel before 11 April. I am not able to make the cancellation. Can you help me please? I want to cancel Fishbrain premium. Buy on our family account by: Mathisricard@hotmail.com",3,"[hello, application, must, cancel, 11, april, able, make, cancellation, help, please, want, cancel, fishbrain, premium, buy, family, account, mathisricard, hotmail, com]","email,account"
4027,"Junk Mail settings are received. However, there is no way to do?",3,"[junk, mail, settings, receive, however, way]","email,account"
2868,"I used the modified Device id landing mailbox and mobile devices such as a Screen Computer still always jump out of the prompt to enter the old Device id mailbox password in the old password, of course, the error.",3,"[use, modify, device, id, land, mailbox, mobile, devices, screen, computer, still, always, jump, prompt, enter, old, device, id, mailbox, password, old, password, course, error]","email,account"
243,"Hello, I can not put my password in my Device TV",3,"[hello, put, password, device, tv]","email,account"
2842,"Hello I have received a fraudulent e-mail telling me that I have entered into a prize draw to win a SmartPhone 8, and if you want to I have to pay 1Û. Logically is a fraudulent e-mail and are using your brand to do so. Where the forwarding?",3,"[hello, receive, fraudulent, e, mail, tell, enter, prize, draw, win, smartphone, 8, want, pay, 1, logically, fraudulent, e, mail, use, brand, forward]","email,account"
2539,Why can't I access account cannot log in to the payment of Po?,3,"[access, account, log, payment, po]","email,account"
2537,My Account is partymasters malicious subscription charge the need for a refund.,3,"[account, partymasters, malicious, subscription, charge, need, refund]","email,account"
1197,I have changed my password today. ,3,"[change, password, today]","email,account"
4044,"I can't stand this neglect me! Already sent several e-mails due to improper collection, has already spent more than 48 hours and nothing!",3,"[stand, neglect, already, send, several, e, mail, due, improper, collection, already, spend, 48, hours, nothing]","email,account"
2534,Why does this app show my old phone number? So if I make an appointment you guys gonna call my old number? Then how am I going to get my issue resolved? Why do you make it difficult to get hold of someone in support? Why on earth happened to the chat?,3,"[app, show, old, phone, number, make, appointment, guy, gon, na, call, old, number, go, get, issue, resolve, make, difficult, get, hold, someone, support, earth, happen, chat]","email,account"
4203,"Problem sent email went to wrong person, so the know main on but not password. ItÕs for VPN",3,"[problem, send, email, go, wrong, person, know, main, password, vpn]","email,account"
4208,"Please call me at 81888044 and my email is espie.ileto@gmail.com""",3,"[please, call, 81888044, email, espie, ileto, gmail, com]","email,account"
2855,I am trying to Purchase something online and every time I select what I want and go to pay itÕs coming back saying my billing information is incorrect and the transaction has been cancelled when I know my billing address is correct and all my details are,3,"[try, purchase, something, online, every, time, select, want, go, pay, come, back, say, bill, information, incorrect, transaction, cancel, know, bill, address, correct, detail]","email,account"
2529,Newly acquired identity that is used on its own. I don't remember about contact at all.,3,"[newly, acquire, identity, use, remember, contact]","email,account"
2527,"I have another appliance but i forgot the date of birth , but i know the password and the Cluster but the account is locked How do I unlock ??",3,"[another, appliance, forget, date, birth, know, password, cluster, account, lock, unlock]","email,account"
4041,I have received several emails about log ins from other devices. Are these truly from Device?,3,"[receive, several, email, log, ins, devices, truly, device]","email,account"
1444,Because I can chat with someone ?,3,"[chat, someone]","email,account"
2524,In that mail is attached a pdf to which I did not want to open,3,"[mail, attach, pdf, want, open]","email,account"
2898,Check the email,3,"[check, email]","email,account"
2900,I did not go into your store or call about device Pencil why have I got someoneÕs information on my Device ID,3,"[go, store, call, device, pencil, get, someone, information, device, id]","email,account"
2972,YouTube for public still havenÕt got them emails and stuff ex.,3,"[youtube, public, still, get, email, stuff, ex]","email,account"
376,Does not Device Store,3,"[device, store]","email,account"
2945,"MusicPlayer., Android Games. YouTube. Ex.",3,"[musicplayer, android, game, youtube, ex]","email,account"
1474,Option to update account information.,3,"[option, update, account, information]","email,account"
2948,"I can not use it: it stubbornly displays my old mobile number, no solution for the change and on my account the number is good; therefore I get a bunch of emails to say that I am not reachable",3,"[use, stubbornly, display, old, mobile, number, solution, change, account, number, good, therefore, get, bunch, email, say, reachable]","email,account"
2468,The support called me but I cannot hear or speak with them,3,"[support, call, hear, speak]","email,account"
1475,"Oba: I am not able to change the card number of the signature Cluster.""",3,"[oba, able, change, card, number, signature, cluster]","email,account"
3998,I am unable to get any mail on my SmartPhone not my Cluster or even a Gmail is there anyway somebody could call me back and help me IÕve been into the store and IÕve called several times and nobody seems to be to have an answer,3,"[unable, get, mail, smartphone, cluster, even, gmail, anyway, somebody, could, call, back, help, store, call, several, time, nobody, seem, answer]","email,account"
2954,"My only solution is to change the phone but""",3,"[solution, change, phone]","email,account"
2463,Pls erase jennifer@momentum.ae because itÕs not a working email anymore you can call her 0554464842 her name is jennifer IÕm the new owner now Norlie,3,"[pls, erase, jennifer, momentum, ae, work, email, anymore, call, 0554464842, name, jennifer, new, owner, norlie]","email,account"
914,Do not have another phone or device.,3,"[another, phone, device]","email,account"
2962,Plz note to gmail and MicrWindowsoft and outlook and ex.,3,"[plz, note, gmail, micrwindowsoft, outlook, ex]","email,account"
2964,IÕm still missing mail IÕm pretty sure. Money and so on. And or ex.,3,"[still, miss, mail, pretty, sure, money, ex]","email,account"
1104,"Replacing an ID account to log on why the update software, the rebound in the previous ID account",3,"[replace, id, account, log, update, software, rebound, previous, id, account]","email,account"
2968,I still havenÕt received old accounts and mail. And emails and money and ex.,3,"[still, receive, old, account, mail, email, money, ex]","email,account"
3985,I ' d f0988183588@cluster.com,3,"[f0988183588, cluster, com]","email,account"
3984,"""My device id cannot use a small amount of pay",3,"[device, id, use, small, amount, pay]","email,account"
221,How do I save pictures on Facebook that were mailed to me,3,"[save, picture, facebook, mail]","email,account"
4227,My app Cluster account bought a app I didnÕt wonÕt,3,"[app, cluster, account, buy, app]","email,account"
1146,Thanks for assisting me with my account recovery. ÊWhy is my email/cluster & find my SmartPhone app lock & I canÕt get it to turn off. Hacker?,3,"[thank, assist, account, recovery, email, cluster, find, smartphone, app, lock, get, turn, hacker]","email,account"
1131,Why can't I send the mobile phone repair,3,"[send, mobile, phone, repair]","email,account"
4025,"the device support email below, you will receive until he was using the logo.",3,"[device, support, email, receive, use, logo]","email,account"
4023,My phone is freezing when trying to send texts with photWindows. What can I do?,3,"[phone, freeze, try, send, texts, photwindows]","email,account"
2503,"Ò The James Bond Collection Ò itÕs telling me only U.K. MusicPlayer has it , should I purchase it there and transfer to US or why this collection is not available anymore in US ? ",3,"[jam, bond, collection, tell, u, k, musicplayer, purchase, transfer, us, collection, available, anymore, us]","email,account"
2501,How Cana device I no longer have be deleted from showing in my account.,3,"[cana, device, longer, delete, show, account]","email,account"
4022,"I receive e mail from Device that someone changed the password, I believe itÕs spam",3,"[receive, e, mail, device, someone, change, password, believe, spam]","email,account"
2500,Not good. I need to update payment info and gave up getting someone on the phone and cannot find a prompt at Device support to update payment info. ÊThis is lame,3,"[good, need, update, payment, info, give, get, someone, phone, find, prompt, device, support, update, payment, info, lame]","email,account"
2499,Please have someone from Device Support call me. Thank you!,3,"[please, someone, device, support, call, thank]","email,account"
2913,I have forgotten the password.,3,"[forget, password]","email,account"
2494,Please open the account for the AppStore so I can buy from applications,3,"[please, open, account, appstore, buy, applications]","email,account"
2492,"My old home number is linked to my contact info, this is wrong, and now Device canÕt call me!!",3,"[old, home, number, link, contact, info, wrong, device, call]","email,account"
2491,I am an able to get my Cluster email I went to the store and still not able to receive or on verification that thatÕs my email I have about six emails and I canÕt accounts open on Skype and Facebook and Instagram that I never made and I can get into,3,"[able, get, cluster, email, go, store, still, able, receive, verification, email, six, email, account, open, skype, facebook, instagram, never, make, get]","email,account"
2490,I need my settings private from ex please help,3,"[need, settings, private, ex, please, help]","email,account"
4014,You cannot change the contact phone,3,"[change, contact, phone]","email,account"
2486,"If i put for my contacts only, do not see it.",3,"[put, contact, see]","email,account"
2926,Why do I have to set an ID to download the software is another ID?,3,"[set, id, download, software, another, id]","email,account"
4050,"I keep getting notices fro Device Support that I have purchased in-app games, that I have not purchased. Despite sending these notices back to you to investigate, they have continued. I do not play these games and want these suppWindowsed purchases to be invali",3,"[keep, get, notice, fro, device, support, purchase, app, game, purchase, despite, send, notice, back, investigate, continue, play, game, want, suppwindowsed, purchase, invali]","email,account"
4051,"Recently an adult website contacted me, and billed my account . ÊThis was an accident and I would like to be removed because I am being harassed",3,"[recently, adult, website, contact, bill, account, accident, would, like, remove, harass]","email,account"
4197,IÕve been directed to device to get a refund from EliteSingles.,3,"[direct, device, get, refund, elitesingles]","email,account"
2714,"Your support device""",3,"[support, device]","email,account"
2716,"""Hello Device !",3,"[hello, device]","email,account"
2718,My e-mail ,3,"[e, mail]","email,account"
2720,How do I get access to the barring password is now has an incorrect password 7 times.,3,"[get, access, bar, password, incorrect, password, 7, time]","email,account"
2721,The app has incorrect mobile number and won't let me change it. So device calls a different number.,3,"[app, incorrect, mobile, number, let, change, device, call, different, number]","email,account"
2644,The password is not very convenient,3,"[password, convenient]","email,account"
301,We got an email today saying there was suspicious activity on our app account. It gave an order number of 1FA3UHFUZ and doc #485485818156. The charge was approximately 54 or 56 dollars. It was not our charge. Can U check this for us?,3,"[get, email, today, say, suspicious, activity, app, account, give, order, number, 1fa3uhfuz, doc, 485485818156, charge, approximately, 54, 56, dollars, charge, u, check, us]","email,account"
2725,Not any help at all. I am American living in South Korea. ÊIf I change my region everything is in Korean and I canÕt understand it. When I put my region as American English you do not recognize my phone number. You should have the option for email. ÊSherr,3,"[help, american, live, south, korea, change, region, everything, korean, understand, put, region, american, english, recognize, phone, number, option, email, sherr]","email,account"
2731,This is the file number the good,3,"[file, number, good]","email,account"
4139,"at Device, check and",3,"[device, check]","email,account"
4142,we will contact you don't want.,3,"[contact, want]","email,account"
309,"This message is for more than 48 hours to verify the account information of Device, has the time to be sent.",3,"[message, 48, hours, verify, account, information, device, time, send]","email,account"
310,"Currently, the Device in the customer's account information has not been confirmed.",3,"[currently, device, customer, account, information, confirm]","email,account"
2617,"MusicPlayer cards, billing, more and more, but no credit.",3,"[musicplayer, card, bill, credit]","email,account"
311,Therefore the customer's MusicPlayer account is frozen.,3,"[therefore, customer, musicplayer, account, freeze]","email,account"
318,"""How can I use amarth40@cluster.com throughout my Screen and SmartPhone X without the albert_marth@yahoo.com popping up?",3,"[use, amarth40, cluster, com, throughout, screen, smartphone, x, without, albert, marth, yahoo, com, pop]","email,account"
2715,I forgot my password to restrict access to,3,"[forget, password, restrict, access]","email,account"
2647,There is not enough information to reset your security questions,3,"[enough, information, reset, security, question]","email,account"
1221,My devices are flippin out & saying my password is incorrect & blah blah - I wanted to download a simple PDF reader because devices Reader app wonÕt do it!!! And IÕm getting blocked by Device & told my password is incorrect & blah blah - talk about control,3,"[devices, flippin, say, password, incorrect, blah, blah, want, download, simple, pdf, reader, devices, reader, app, get, block, device, tell, password, incorrect, blah, blah, talk, control]","email,account"
4129,the clWindowsest Device Store...,3,"[clwindowsest, device, store]","email,account"
2678,Someone is signed into my Cluster,3,"[someone, sign, cluster]","email,account"
1340,"""We could not contact 001 8004412904 for the support. Is there another way out.",3,"[could, contact, 001, 8004412904, support, another, way]","email,account"
1336,My ID is deactivated,3,"[id, deactivate]","email,account"
4115,Since last update I cannot receive mail,3,"[since, last, update, receive, mail]","email,account"
4114,Last update no mail,3,"[last, update, mail]","email,account"
1360,"""Last night I received a invoice for an app I donÕt recognize nor did I subscribe to, IÕm not sure if itÕs from Device or a scam email ",3,"[last, night, receive, invoice, app, recognize, subscribe, sure, device, scam, email]","email,account"
289,"""An error is displayed, and you do not have access to support information.",3,"[error, display, access, support, information]","email,account"
2662,"This APP, the callback request phone number why is fixed on the basis of Device id extracted from the inside of the Device id do the phone changes. Why is the old phone number each time you request a callback phone manual changes to trouble, please send to answer and resolve the questions",3,"[app, callback, request, phone, number, fix, basis, device, id, extract, inside, device, id, phone, change, old, phone, number, time, request, callback, phone, manual, change, trouble, please, send, answer, resolve, question]","email,account"
2701,Rubbish. I didnÕt receive any response other than an automated one on receipt of my email,3,"[rubbish, receive, response, automate, one, receipt, email]","email,account"
4109,"Tamara told me to log off Cluster therefore lWindowsing contact and having to start again and after pleading""",3,"[tamara, tell, log, cluster, therefore, lwindowsing, contact, start, plead]","email,account"
2656,I canÕt receive messages because it was disabled by the hacker. What shall I do do to prevent this hacker accessing my account?,3,"[receive, message, disable, hacker, shall, prevent, hacker, access, account]","email,account"
2706,"Device Support app should work with my Cluster calendar along with my Outlook calendar, and use a custom color on my Cluster calendar for my appointments scheduled via the app.",3,"[device, support, app, work, cluster, calendar, along, outlook, calendar, use, custom, color, cluster, calendar, appointments, schedule, via, app]","email,account"
1366,The account or the original old phone did not update,3,"[account, original, old, phone, update]","email,account"
4107,I am extremely regretting purchasing from MusicPlayer. I will no longer purchase anything fro MusicPlayer. What a waste of time and money.,3,"[extremely, regret, purchase, musicplayer, longer, purchase, anything, fro, musicplayer, waste, time, money]","email,account"
1321,May I ask the general limitations of forgot password to open,3,"[may, ask, general, limitations, forget, password, open]","email,account"
1294,You should not change the mobile number.,3,"[change, mobile, number]","email,account"
4152,The phone number is not changed,3,"[phone, number, change]","email,account"
2757,App all support,3,"[app, support]","email,account"
270,Send me an e-mail to re confirm my password Please Serge,3,"[send, e, mail, confirm, password, please, serge]","email,account"
2799,"It shows me that it has mail, starts to download and simple stops ( without any download at all) and says Òupdate just nowÓ.",3,"[show, mail, start, download, simple, stop, without, download, say, update]","email,account"
4178,"I havenÕt been able to make a purchase on the app site for days. ÊIt wonÕt let me in. ÊI have changed my password, and can log into device.com, but the Android Games will not recognize my password",3,"[able, make, purchase, app, site, days, let, change, password, log, device, com, android, game, recognize, password]","email,account"
4066,Please send my apologies the organisation that I have requested. I have made a hard time for them. The keys are displayed on (pin*fasf-prcs) and they will know who I am dealing with and the DisclWindowsure copying booklet of Suncorp on the day I sent my email,3,"[please, send, apologies, organisation, request, make, hard, time, key, display, pin, fasf, prcs, know, deal, disclwindowsure, copy, booklet, suncorp, day, send, email]","email,account"
4181,strong message only,3,"[strong, message]","email,account"
2567,When the crap you sell clWindowses itÕs self then asks you for a password you never heard of ... ,3,"[crap, sell, clwindowses, self, ask, password, never, hear]","email,account"
1243,Need to change the password i can't remember,3,"[need, change, password, remember]","email,account"
1237,"your account, there were some problems, so, please update your account details.",3,"[account, problems, please, update, account, detail]","email,account"
1235,.com account is locked for a few moments.,3,"[com, account, lock, moments]","email,account"
1230,"""From the email address below for information about the lock there was a mail account.",3,"[email, address, information, lock, mail, account]","email,account"
