row_id,message,cluster_id,message_clean,represent_name
3367,i cant change secuirty qustions because i forget answring ,6,"[cant, change, secuirty, qustions, forget, answring]","provider,device"
3480,You support agent didnÕt seem like he wanted to help at all. Then just got off chat abruptly. Not what i expected from device,6,"[support, agent, seem, like, want, help, get, chat, abruptly, expect, device]","provider,device"
746,IÕm a Creative at R288 Lexington Ky Device store. ÊMaking a reservation for a Genius Bar appointment should not require a selection of a certain issue. It should be front and center. Customers should not have to seek help on using an app to get the help th,6,"[creative, r288, lexington, ky, device, store, make, reservation, genius, bar, appointment, require, selection, certain, issue, front, center, customers, seek, help, use, app, get, help, th]","provider,device"
3443,The APP I want to re-establish an account previous account Ding used to?,6,"[app, want, establish, account, previous, account, ding, use]","provider,device"
3611,I would like to change your password,6,"[would, like, change, password]","provider,device"
713,In Òchange locationÓ it donÕt exist Spain and is not pWindowssible change the language to spanish. Thks,6,"[change, location, exist, spain, pwindowssible, change, language, spanish, thks]","provider,device"
3620,I did not order anything,6,"[order, anything]","provider,device"
866,"Learn how to Manage your password preferences for MusicPlayer, Books Online and Android Games purchases.",6,"[learn, manage, password, preferences, musicplayer, book, online, android, game, purchase]","provider,device"
657,Not your mother does not give refund on the,6,"[mother, give, refund]","provider,device"
3540,Thank you for helping me to solve the problem in a timely manner,6,"[thank, help, solve, problem, timely, manner]","provider,device"
773,"first of all thank you for the promptness of response to my request of chat startup and I apologize for not having replied to the operator, but i did not know where to find the active chat and then felt that wrote to me, but i did not know where to respond. I s""",6,"[first, thank, promptness, response, request, chat, startup, apologize, reply, operator, know, find, active, chat, felt, write, know, respond]","provider,device"
879,Android Games cannot update the app did not know how to set up a thank you reply,6,"[android, game, update, app, know, set, thank, reply]","provider,device"
3391,I keep having problem someone hacking my SmartPhone,6,"[keep, problem, someone, hack, smartphone]","provider,device"
654,Thanks for the support via ÔchatÕ good to get advice and I like the record of the chat that is stored on my history.,6,"[thank, support, via, chat, good, get, advice, like, record, chat, store, history]","provider,device"
3591,i want too buy and click action and house and passport and visa bank,6,"[want, buy, click, action, house, passport, visa, bank]","provider,device"
3453,"Please forward all of my financial transactions from 2016-2017 from NAB and Suncorp as I have found a new information, to the Asian.com, and the fog.com. I'll try to make an excuse to get to VIC , Aus as soon as pWindowssible.",6,"[please, forward, financial, transactions, 2016, 2017, nab, suncorp, find, new, information, asian, com, fog, com, try, make, excuse, get, vic, aus, soon, pwindowssible]","provider,device"
3454,I submit the question but have not received back to the previous version is very quickly to your customer service call.,6,"[submit, question, receive, back, previous, version, quickly, customer, service, call]","provider,device"
3324,Grandson ordered app mlsg7802mz on my phone apps without permission please remove app and payment thank you Susan MORRIS,6,"[grandson, order, app, mlsg7802mz, phone, apps, without, permission, please, remove, app, payment, thank, susan, morris]","provider,device"
3375,"""Hi! Had an DeviceCare support call today. Reps were friendly, and I think I got my problem resolved.",6,"[hi, devicecare, support, call, today, reps, friendly, think, get, problem, resolve]","provider,device"
3557,I am unable to create group name of iMessage.... no such option appears,6,"[unable, create, group, name, imessage, option, appear]","provider,device"
3319,i want recents my questions security,6,"[want, recents, question, security]","provider,device"
702,"""No one is calling super but i get a mail where it says I was not to achieve",6,"[one, call, super, get, mail, say, achieve]","provider,device"
3469,I need a call ASAP. 7033330988,6,"[need, call, asap, 7033330988]","provider,device"
835,Give the ability to add an infinite amount of apps in the dock. Ê,6,"[give, ability, add, infinite, amount, apps, dock]","provider,device"
3384,I already sent 3 requests for me or call me and I didn't get any response.... i am still waiting for you to help me solve a problem from my SmartPhone X,6,"[already, send, 3, request, call, get, response, still, wait, help, solve, problem, smartphone, x]","provider,device"
698,I don't get the notifications of Instagram. How can i add this app to Notifications? Before I arrived but since i made the setting you told me from the technical support I have not returned to receive them,6,"[get, notifications, instagram, add, app, notifications, arrive, since, make, set, tell, technical, support, return, receive]","provider,device"
3321,Please help me solve this issue. ,6,"[please, help, solve, issue]","provider,device"
885,I believe that we could have more confidence in the SmartPhone if at the time of off put a password.,6,"[believe, could, confidence, smartphone, time, put, password]","provider,device"
692,Everything is great thank you,6,"[everything, great, thank]","provider,device"
677,"I would like to start an online chat, however I donÕt seem to have this available to me.",6,"[would, like, start, online, chat, however, seem, available]","provider,device"
3368,"please help me to forget secuirty""",6,"[please, help, forget, secuirty]","provider,device"
689,All the mls shop orders are not sent for repair,6,"[mls, shop, order, send, repair]","provider,device"
3386,"""""""Your device ID security questions yesterday. The email has come.""""",6,"[device, id, security, question, yesterday, email, come]","provider,device"
3303,Thank you OH,6,"[thank, oh]","provider,device"
3327,Contact with Device Support later on ,6,"[contact, device, support, later]","provider,device"
3471,I just want to consolidate my Device IDs to keep track of purchases and stop having three accounts. Can someone at Device Support help me?,6,"[want, consolidate, device, ids, keep, track, purchase, stop, three, account, someone, device, support, help]","provider,device"
3300,"I was at an Device store, I had a negative experience is not i had adequate explanations about your propWindowsition of Device care,problem shared also by the store manager. I have reported the criticality also through",6,"[device, store, negative, experience, adequate, explanations, propwindowsition, device, care, problem, share, also, store, manager, report, criticality, also]","provider,device"
737,"My phone number is no longer correct, but you've changed everything here in the app is still the old to see :(",6,"[phone, number, longer, correct, change, everything, app, still, old, see]","provider,device"
3586,I ask for location setting to be fixed several time it sad you can't fix your own product,6,"[ask, location, set, fix, several, time, sad, fix, product]","provider,device"
3455,"How can i recover my contacts, because I erased",6,"[recover, contact, erase]","provider,device"
648,"Find a battery is not less money also to be difficult is really bad and the""",6,"[find, battery, less, money, also, difficult, really, bad]","provider,device"
656,"Hello! I would like to make a suggestion for the upcoming iWindows Updates. It would be very useful to be able to activate/deactivate the dark/night mode from the control center. It would be much easier and simple, rather than going into Settings",6,"[hello, would, like, make, suggestion, upcoming, iwindows, update, would, useful, able, activate, deactivate, dark, night, mode, control, center, would, much, easier, simple, rather, go, settings]","provider,device"
3275,I do not see how to chat. Is this it?,6,"[see, chat]","provider,device"
3414,"""Mono (spelling of his name...not sure of), was great.",6,"[mono, spell, name, sure, great]","provider,device"
789,"""SmartPhone 4 update from the city code is not at all. An example of the 072 instead of 0729. If we can get over the phone which boasts an early fix please.",6,"[smartphone, 4, update, city, code, example, 072, instead, 0729, get, phone, boast, early, fix, please]","provider,device"
3337,"I've just received an e-mail to This e-mail address Jskgas921-ksmdndada029-killerbeWindowsk271@support-jealousemailwkwkland.com with a so-called purchase, but i have not purchased through MusicPlayer. I also have no credit card related to my Device ID.",6,"[receive, e, mail, e, mail, address, jskgas921, ksmdndada029, killerbewindowsk271, support, jealousemailwkwkland, com, call, purchase, purchase, musicplayer, also, credit, card, relate, device, id]","provider,device"
3426,I have been compromised on my I Pad . On my Hangout account . I was just now threaten Êfrom John Lordes. People are using my app to talk with others . I have asked them to leave several times .They have me use their Email to get into Hangout. I believe Ap,6,"[compromise, pad, hangout, account, threaten, john, lord, people, use, app, talk, others, ask, leave, several, time, use, email, get, hangout, believe, ap]","provider,device"
845,Would be good to be able to track repairs from the app!,6,"[would, good, able, track, repair, app]","provider,device"
795,Add songs to the source of the HWindowshino.,6,"[add, songs, source, hwindowshino]","provider,device"
3521,I cluster foto_raflarõmda i have a problem with would be to help you disable clusteru siliyorum foto_raflarõmda exclamation mark in the desert. Without the use of my photWindows in internetim cellular data is that the mature,6,"[cluster, foto, raflar, mda, problem, would, help, disable, clusteru, siliyorum, foto, raflar, mda, exclamation, mark, desert, without, use, photwindows, internetim, cellular, data, mature]","provider,device"
776,"""Hello, I noticed that the phone number in the Device Support app is different than my actual number. ",6,"[hello, notice, phone, number, device, support, app, different, actual, number]","provider,device"
818,Hi I have a idea for people to choWindowse what is private apps that can be in a folder that needs a Touch ID to get in to it for a extra step in privacy.,6,"[hi, idea, people, chowindowse, private, apps, folder, need, touch, id, get, extra, step, privacy]","provider,device"
3406,"HELP ME UNLOCK IT ASAP""",6,"[help, unlock, asap]","provider,device"
797,Would be nice to be able to track a repair status via this app.,6,"[would, nice, able, track, repair, status, via, app]","provider,device"
3422,I cannot stop a porn site from popping up. Why,6,"[stop, porn, site, pop]","provider,device"
3398,In hardware support katagorisine you must add more options,6,"[hardware, support, katagorisine, must, add, options]","provider,device"
915,Do not have another phone number besides 337-296-2257,6,"[another, phone, number, besides, 337, 296, 2257]","provider,device"
3486,Really Thanks Device!!!! You are magnificent and the products the best on the planet !!!! I love my computers !!!!,6,"[really, thank, device, magnificent, products, best, planet, love, computers]","provider,device"
3650,"I received a mail, of something I had bought in the Apo Store; and I have not been. I need help please. Thank you.",6,"[receive, mail, something, buy, apo, store, need, help, please, thank]","provider,device"
3360,"""Useless app, severe, no help to get. If you call it ports i in ngn damn queue with background music!!! If you callers you well for the hell talking!!!",6,"[useless, app, severe, help, get, call, port, ngn, damn, queue, background, music, callers, well, hell, talk]","provider,device"
3656,Or can we find the amount of my account,6,"[find, amount, account]","provider,device"
859,request : 20000003452043 practice,6,"[request, 20000003452043, practice]","provider,device"
3487,Forget the access restriction password. What can I do,6,"[forget, access, restriction, password]","provider,device"
3646,I need some assistance and I need someone to call me IÕm not doing this online stuff. 770-881-1304,6,"[need, assistance, need, someone, call, online, stuff, 770, 881, 1304]","provider,device"
3661,The air is very sunny Face ID does not lock or full lock open up to the time we go to the elim like smoke Face ID does not try again on the Face ID enter password as any koysanõz bassak him again as i think it would be nice if it unilaterally recognizes yzmz,6,"[air, sunny, face, id, lock, full, lock, open, time, go, elim, like, smoke, face, id, try, face, id, enter, password, koysan, z, bassak, think, would, nice, unilaterally, recognize, z, z]","provider,device"
907,The 4s I can't use the Forgotten Password,6,"[4s, use, forget, password]","provider,device"
903,"clouds to the creamy Milky Way.....lol what a metiphor, just trust me give me the tools and I promise you will be proud, a liaison to information, meaning a real person , that I could talk to until I get secure enough device to weather me thru this storm",6,"[cloud, creamy, milky, way, lol, metiphor, trust, give, tool, promise, proud, liaison, information, mean, real, person, could, talk, get, secure, enough, device, weather, thru, storm]","provider,device"
3284,you can book at all in getting help.,6,"[book, get, help]","provider,device"
3537,"My account purchase error code 2037, how to fix, Thanks",6,"[account, purchase, error, code, 2037, fix, thank]","provider,device"
810,Got two phones both accounts hacked. One cousin works at SmartPhone store other in shipping. 8174540429. If I could get security to fix this problem,6,"[get, two, phone, account, hack, one, cousin, work, smartphone, store, ship, 8174540429, could, get, security, fix, problem]","provider,device"
777,"The number listed in the Support app is 905-830-2454 but my actual number is 905-830-2457.""",6,"[number, list, support, app, 905, 830, 2454, actual, number, 905, 830, 2457]","provider,device"
3396,May I know if you have any contact number?,6,"[may, know, contact, number]","provider,device"
778,"""Problem with the application E that has lWindowst a day to the other the function """"direct"""" both on pad that SmartPhone. Or send me since it can no longer have the chain through free or Canalsat....",6,"[problem, application, e, lwindowst, day, function, direct, pad, smartphone, send, since, longer, chain, free, canalsat]","provider,device"
855,"Good evening , I have just received a message from a purchase that was not made, I think it is a fraud to put username and password",6,"[good, even, receive, message, purchase, make, think, fraud, put, username, password]","provider,device"
864,App well done only that I cannot tell you an app called TDownloader that to me was illegal and I wanted to ask why is not removed from the Device Store. Many thanks,6,"[app, well, do, tell, app, call, tdownloader, illegal, want, ask, remove, device, store, many, thank]","provider,device"
738,My experience with learning how to navigate these IPhones and the internet from my standpoint has been a tremendous work for me and I know what IÕm going to do for you guys and my family for a long time I am sure that I will have a good time with my famil,6,"[experience, learn, navigate, iphones, internet, standpoint, tremendous, work, know, go, guy, family, long, time, sure, good, time, famil]","provider,device"
647,to be stocked up to the date of the appointment time for guests to complete the repair.,6,"[stock, date, appointment, time, guests, complete, repair]","provider,device"
3482,Why is Device billing me without my permission. How do they have a hold of my bank details? Why are they billing me? I did not authorities these transactions of 10% happier and Candcrush I deleted because it was automatically Billing me & I have no idea ho,6,"[device, bill, without, permission, hold, bank, detail, bill, authorities, transactions, 10, happier, candcrush, delete, automatically, bill, idea, ho]","provider,device"
743,I have a problem with a Device TV TO1427,6,"[problem, device, tv, to1427]","provider,device"
3638,My phone number is incorrect,6,"[phone, number, incorrect]","provider,device"
721,"I put fifty dollars on my MusicPlayer account last week and havenÕt made one purchase but, all money had been spent this had been going on for a few months now with no solution IÕd like to find out where my money is going if IÕm not spending it",6,"[put, fifty, dollars, musicplayer, account, last, week, make, one, purchase, money, spend, go, months, solution, like, find, money, go, spend]","provider,device"
3136,What the hell is going on?,5,"[hell, go]","device,query"
4296,Have the status of a repair show in the app,5,"[status, repair, show, app]","device,query"
2141,"Screen just faded away whilst using computer, after a forced shut down did a bit on it and shut it down. Next time I used it the same thing happened. Did the shut down again, this happened three times before it faded and I could not restart""",5,"[screen, fade, away, whilst, use, computer, force, shut, bite, shut, next, time, use, thing, happen, shut, happen, three, time, fade, could, restart]","device,query"
2182,This is horrible frustrating no goodvdisssppointing just purchased a brand new battery and worse than before much much worse,5,"[horrible, frustrate, goodvdisssppointing, purchase, brand, new, battery, worse, much, much, worse]","device,query"
2145,Red history of my purchasing for the last 6 months,5,"[red, history, purchase, last, 6, months]","device,query"
2185,"""Dear Device,",5,"[dear, device]","device,query"
3131,I have a damage on my Screen Pro and tried to call in for support yesterday and checked through location in Hong Kong through Device support apps. Neither can help within this week and end up asking me to check everyday if there is an open slot for me to bri,5,"[damage, screen, pro, try, call, support, yesterday, check, location, hong, kong, device, support, apps, neither, help, within, week, end, ask, check, everyday, open, slot, bri]","device,query"
4265,"It would be good to have the pWindowssibility to transmit different photWindows, screenshot to be able to show the problem encountered.",5,"[would, good, pwindowssibility, transmit, different, photwindows, screenshot, able, show, problem, encounter]","device,query"
4264,I received a email stating that I made a 334.99 MusicPlayer purchase. I did not. They said I have to update my credit card .Is this true?,5,"[receive, email, state, make, 334, 99, musicplayer, purchase, say, update, credit, card, true]","device,query"
4279,I no longer have keychain since I upgraded to the new iWindows you just asked us to upgrade. I have to enter all of my usernames and passwords every time I log into an app. After I log in it doesnÕt ask if I want to save my passwords. What did you guys do with,5,"[longer, keychain, since, upgrade, new, iwindows, ask, us, upgrade, enter, usernames, passwords, every, time, log, app, log, ask, want, save, passwords, guy]","device,query"
4289,Having a hand in the cf games the value to the $30 results in the wrong with 198 million hopes to be able to refund this is a waste of money Thank You,5,"[hand, cf, game, value, 30, result, wrong, 198, million, hop, able, refund, waste, money, thank]","device,query"
3117,There is no view is maintaining the progress report that you want to add.,5,"[view, maintain, progress, report, want, add]","device,query"
2177,My country not there in your application ,5,"[country, application]","device,query"
2176,"""Hi i need your help ",5,"[hi, need, help]","device,query"
3119,Can you please Êput on restriction I have a 7 year old. And thereÕs a I have a medal plate in my head.,5,"[please, put, restriction, 7, year, old, medal, plate, head]","device,query"
4295,"IÕve just received a suspicious email telling me that ive just purchased an app, i took some screen capture and wanted to show you. The thing is that is has an option to reset the password and a link to click on if i didnt buy the app and ask me to enter",5,"[receive, suspicious, email, tell, ive, purchase, app, take, screen, capture, want, show, thing, option, reset, password, link, click, didnt, buy, app, ask, enter]","device,query"
2174,This app is useless!,5,"[app, useless]","device,query"
3126,You want to know the hanging of the itunes.,5,"[want, know, hang, itunes]","device,query"
2171,"At any time you do no better in the reply. Why is that?""",5,"[time, better, reply]","device,query"
3123,Want to change it to a SmartPhone6s Rear Housing,5,"[want, change, smartphone6s, rear, house]","device,query"
2169,"""Not taking reservations from Android Gamess.",5,"[take, reservations, android, game]","device,query"
4281,"""35534808743569 IMEI of the device in the list of linked clones for use Hashemite Kingdom of 12.05.2018 Hattiniz birakilacaktir.on.The Information inserted will no longer be activated to search for 532 B002",5,"[35534808743569, imei, device, list, link, clone, use, hashemite, kingdom, 12, 05, 2018, hattiniz, birakilacaktir, information, insert, longer, activate, search, 532, b002]","device,query"
4277,As simple as the motion sensor for a subject i cannot believe the problem with the phone selection ya_adõ_õma really when i was regret for device i,5,"[simple, motion, sensor, subject, believe, problem, phone, selection, ya, ad, really, regret, device]","device,query"
2160,Amazing app!!,5,"[amaze, app]","device,query"
2159,I need help with my mobile network,5,"[need, help, mobile, network]","device,query"
4280,It is very good and they help you very well,5,"[good, help, well]","device,query"
4261,DidnÕt get help,5,"[get, help]","device,query"
2240,"""Hacking is still continued.",5,"[hack, still, continue]","device,query"
3377,"Ñ I provided the serial number for my product, but the rep didnÕt tell me whether or not it was under warranty; I had to look that up on my own""",5,"[provide, serial, number, product, rep, tell, whether, warranty, look]","device,query"
2196,Screen Air 16GB total storage space is used when you purchased a 4.5GB and I made a few applications and games (plus a 11.8GB 4.5GB) only have 4.2GB cannot use it to download a 2GB of games says that there is not enough space comma my efforts.,5,"[screen, air, 16gb, total, storage, space, use, purchase, 4, 5gb, make, applications, game, plus, 11, 8gb, 4, 5gb, 4, 2gb, use, download, 2gb, game, say, enough, space, comma, efforts]","device,query"
2265,Hello Contact Me These for an invoice on my account for Sleep premium cycle c is a test only Thank You,5,"[hello, contact, invoice, account, sleep, premium, cycle, c, test, thank]","device,query"
4176,Cancel. Our. ÊI. Tunes. On Melissa. Ê(Here) and John. BWindowshart. 706-982-1160. ,5,"[cancel, tune, melissa, john, bwindowshart, 706, 982, 1160]","device,query"
4170,"I want a refund.""",5,"[want, refund]","device,query"
2278,"""I hope you can query the other device's serial number.",5,"[hope, query, device, serial, number]","device,query"
2280,Third Party Products Without Service Guarantee Service location not clear,5,"[third, party, products, without, service, guarantee, service, location, clear]","device,query"
4168,to open the collection of Feature Is there a way to verify that the update...,5,"[open, collection, feature, way, verify, update]","device,query"
4166,"Rodney has been unprofessional dealing with my request, even if I told him I am on a deadline",5,"[rodney, unprofessional, deal, request, even, tell, deadline]","device,query"
2288,"""Dear sir,",5,"[dear, sir]","device,query"
2289,I need to start Device store in Qatar ,5,"[need, start, device, store, qatar]","device,query"
2292,"Hello, I have the cell failed and wanted to give me an appointment at the nearest store. I have been told that I have to do it through this application.",5,"[hello, cell, fail, want, give, appointment, nearest, store, tell, application]","device,query"
4165,"Hello, I lWindowst the phone I would like to tell us how to contact you.",5,"[hello, lwindowst, phone, would, like, tell, us, contact]","device,query"
3078,"SmartPhone7 plus 128GB shows dld starting, but it always fails ca. 5-7 minutes later.Have tried early AM as well as late night dld install times, as well as over the""",5,"[smartphone7, plus, 128gb, show, dld, start, always, fail, ca, 5, 7, minutes, later, try, early, well, late, night, dld, install, time, well]","device,query"
4155,"It would be nice to have a switch to turn off the light ambient sensitivity in the Map app""",5,"[would, nice, switch, turn, light, ambient, sensitivity, map, app]","device,query"
3397,I am worried about the Device ! Already canceled my credit card once per does not recognize a purchase! The same that made me today to cancel purchases over the internet with another purchase by Device in the value of 97.90 on the day 09/04/18 please watch this for me!,5,"[worry, device, already, cancel, credit, card, per, recognize, purchase, make, today, cancel, purchase, internet, another, purchase, device, value, 97, 90, day, 09, 04, 18, please, watch]","device,query"
